{
  "schema": "twtss/placement-result",
  "version": 1,
  "referenceId": "wall-projection",
  "rigId": "studio-rig",
  "cameras": [
    {
      "cameraId": "camera-left",
      "cameraFromReference": [
        0.8979955894619506,
        -0.10489083175595945,
        -0.4273193591687918,
        -0.6000680616803996,
        -0.004029868548028228,
        0.9691691962275859,
        -0.24636320594411185,
        -0.3491115316746686,
        0.4399860014436476,
        0.22295511318899652,
        0.8698869673908862,
        2.2998908949818793,
        0,
        0,
        0,
        1
      ],
      "reprojectionRmsPx": 0.029304,
      "reprojectionMaxPx": 0.043091,
      "pointCount": 6,
      "translationSigmaMeters": 0.004238,
      "rotationSigmaDeg": 0.228068
    },
    {
      "cameraId": "camera-right",
      "cameraFromReference": [
        0.9131437603661787,
        0.07329190546782345,
        0.400994725024171,
        0.7008534233777927,
        0.0059200177389504005,
        0.9812157019759619,
        -0.19282297473535387,
        -0.40018913009101376,
        -0.40759468383957775,
        0.17844899212020227,
        0.8955571064521788,
        2.2003653560014116,
        0,
        0,
        0,
        1
      ],
      "reprojectionRmsPx": 0.064837,
      "reprojectionMaxPx": 0.107427,
      "pointCount": 6,
      "translationSigmaMeters": 0.003187,
      "rotationSigmaDeg": 0.154623
    }
  ],
  "pairs": [
    {
      "from": "camera-left",
      "to": "camera-right",
      "toFromFrom": [
        0.640959,
        -0.031438,
        0.766931,
        -0.689362,
        -0.015207,
        0.998445,
        0.053638,
        -0.184107,
        -0.767425,
        -0.046043,
        0.639484,
        0.253042,
        0,
        0,
        0,
        1
      ],
      "baselineMeters": 0.757063,
      "baselineSigmaMeters": 0.005303
    }
  ],
  "verification": [
    {
      "kind": "distance",
      "a": "camera-left",
      "b": "camera-right",
      "expectedMeters": 0.755,
      "measuredMeters": 0.757063,
      "residualMeters": 0.002063
    }
  ],
  "degraded": false,
  "notes": []
}
